{
  "$schema": "https://json-schema.org/draft/2020-12/schema",
  "$id": "https://vibe-screen.dev/schemas/evidence/v1/macos-hardware-compatibility.schema.json",
  "title": "Vibe Screen macOS Host hardware compatibility matrix row summary v1",
  "type": "object",
  "additionalProperties": false,
  "required": [
    "schema_version",
    "run_id",
    "kind",
    "profile",
    "verdict",
    "can_close_macos_host_compatibility_row",
    "row_scope",
    "observations",
    "invalid_claims",
    "invalid_claim_observations",
    "closure_checklist",
    "missing_requirements",
    "blocking_reasons",
    "artifact_paths",
    "artifact_file_check",
    "artifact_role_check",
    "blocking_notes",
    "notes"
  ],
  "properties": {
    "schema_version": {"const": "vibescreen.evidence/v1"},
    "run_id": {"type": "string", "minLength": 1},
    "kind": {"const": "macos_host_compatibility_matrix_row"},
    "profile": {"const": "macos-host-compatibility-row"},
    "verdict": {"enum": ["pass", "blocked", "insufficient", "failed"]},
    "can_close_macos_host_compatibility_row": {"type": "boolean"},
    "row_scope": {
      "type": "object",
      "additionalProperties": false,
      "required": [
        "owner",
        "implementation_path",
        "repository_commit",
        "repository_tree",
        "repository_dirty_state",
        "cpu_architecture",
        "host_model_identifier",
        "host_cpu_name",
        "macos_version",
        "macos_build",
        "display_topology",
        "capture_backend",
        "stream_transport",
        "android_counterpart",
        "compatibility_scope",
        "xcode_version",
        "swift_version",
        "host_build_identity",
        "host_install_path",
        "host_bundle_id",
        "host_signing_identity",
        "host_signing_leaf_sha1",
        "host_designated_requirement",
        "screen_recording_tcc",
        "screen_recording_tcc_auth_reason",
        "accessibility_tcc",
        "accessibility_tcc_auth_reason",
        "microphone_tcc",
        "microphone_tcc_auth_reason",
        "screen_recording_tcc_identity_bound",
        "accessibility_tcc_identity_bound",
        "microphone_tcc_identity_bound",
        "host_source_commit",
        "host_source_tree",
        "host_source_dirty_state",
        "host_self_test_commit",
        "current_base_commit",
        "current_base_tree",
        "screen_capturekit_result",
        "cgdisplaystream_result",
        "videotoolbox_result",
        "virtual_display_result",
        "mirror_result"
      ],
      "properties": {
        "owner": {"type": "string"},
        "implementation_path": {"type": "string"},
        "repository_commit": {"type": "string"},
        "repository_tree": {"type": "string"},
        "repository_dirty_state": {"enum": ["", "clean", "dirty"]},
        "cpu_architecture": {"enum": ["", "apple_silicon", "intel"]},
        "host_model_identifier": {"type": "string"},
        "host_cpu_name": {"type": "string"},
        "macos_version": {"type": "string"},
        "macos_build": {"type": "string"},
        "display_topology": {"enum": ["", "built_in", "single_external", "multi_display", "dummy_or_headless", "screen_sharing"]},
        "capture_backend": {"enum": ["", "screencapturekit", "cgdisplaystream_fallback", "current_main_fallback", "unavailable"]},
        "stream_transport": {"enum": ["", "usb", "lan"]},
        "android_counterpart": {"type": "string"},
        "compatibility_scope": {"type": "string"},
        "xcode_version": {"type": "string"},
        "swift_version": {"type": "string"},
        "host_build_identity": {"type": "string"},
        "host_install_path": {"type": "string"},
        "host_bundle_id": {"type": "string"},
        "host_signing_identity": {"type": "string"},
        "host_signing_leaf_sha1": {"type": "string"},
        "host_designated_requirement": {"type": "string"},
        "screen_recording_tcc": {"enum": ["", "authorized", "not_authorized", "unverified"]},
        "screen_recording_tcc_auth_reason": {"type": ["integer", "null"]},
        "accessibility_tcc": {"enum": ["", "authorized", "not_authorized", "unverified"]},
        "accessibility_tcc_auth_reason": {"type": ["integer", "null"]},
        "microphone_tcc": {"enum": ["", "authorized", "not_authorized", "unverified"]},
        "microphone_tcc_auth_reason": {"type": ["integer", "null"]},
        "screen_recording_tcc_identity_bound": {"type": "boolean"},
        "accessibility_tcc_identity_bound": {"type": "boolean"},
        "microphone_tcc_identity_bound": {"type": "boolean"},
        "host_source_commit": {"type": "string"},
        "host_source_tree": {"type": "string"},
        "host_source_dirty_state": {"enum": ["", "clean", "dirty"]},
        "host_self_test_commit": {"type": "string"},
        "current_base_commit": {"type": "string"},
        "current_base_tree": {"type": "string"},
        "screen_capturekit_result": {"enum": ["", "selected_display_first_frame", "unavailable_fallback_used", "unavailable_terminal"]},
        "cgdisplaystream_result": {"enum": ["", "fallback_first_frame", "not_used", "unavailable_terminal"]},
        "videotoolbox_result": {"enum": ["", "h264_hevc_available", "h264_only", "hevc_only", "unavailable"]},
        "virtual_display_result": {"enum": ["", "created_online_captured", "fallback_current_main", "unavailable", "not_applicable"]},
        "mirror_result": {"enum": ["", "hardware_mirror", "current_main_fallback", "unavailable", "not_applicable"]}
      }
    },
    "observations": {
      "type": "object",
      "additionalProperties": false,
      "required": [
        "owner_recorded",
        "implementation_path_recorded",
        "repository_commit_recorded",
        "host_model_recorded",
        "cpu_architecture_recorded",
        "macos_version_build_recorded",
        "xcode_swift_recorded",
        "host_build_identity_recorded",
        "signing_and_tcc_state_recorded",
        "source_bound_host_recorded",
        "host_self_test_provenance_recorded",
        "display_topology_recorded",
        "capture_backend_recorded",
        "video_encoder_path_recorded",
        "automated_macos_checks_passed",
        "packaged_host_launch_observed",
        "protocol_v1_stream_observed",
        "display_selection_observed",
        "physical_display_capture_observed",
        "virtual_display_or_fallback_recorded",
        "mirror_or_fallback_recorded",
        "input_smoke_observed",
        "reconnect_observed",
        "runtime_session_coherence_recorded",
        "artifacts_retained",
        "claim_scoped_to_exact_row"
      ],
      "properties": {
        "owner_recorded": {"type": "boolean"},
        "implementation_path_recorded": {"type": "boolean"},
        "repository_commit_recorded": {"type": "boolean"},
        "host_model_recorded": {"type": "boolean"},
        "cpu_architecture_recorded": {"type": "boolean"},
        "macos_version_build_recorded": {"type": "boolean"},
        "xcode_swift_recorded": {"type": "boolean"},
        "host_build_identity_recorded": {"type": "boolean"},
        "signing_and_tcc_state_recorded": {"type": "boolean"},
        "source_bound_host_recorded": {"type": "boolean"},
        "host_self_test_provenance_recorded": {"type": "boolean"},
        "display_topology_recorded": {"type": "boolean"},
        "capture_backend_recorded": {"type": "boolean"},
        "video_encoder_path_recorded": {"type": "boolean"},
        "automated_macos_checks_passed": {"type": "boolean"},
        "packaged_host_launch_observed": {"type": "boolean"},
        "protocol_v1_stream_observed": {"type": "boolean"},
        "display_selection_observed": {"type": "boolean"},
        "physical_display_capture_observed": {"type": "boolean"},
        "virtual_display_or_fallback_recorded": {"type": "boolean"},
        "mirror_or_fallback_recorded": {"type": "boolean"},
        "input_smoke_observed": {"type": "boolean"},
        "reconnect_observed": {"type": "boolean"},
        "runtime_session_coherence_recorded": {"type": "boolean"},
        "artifacts_retained": {"type": "boolean"},
        "claim_scoped_to_exact_row": {"type": "boolean"}
      }
    },
    "invalid_claims": {
      "type": "array",
      "items": {
        "type": "object",
        "additionalProperties": false,
        "required": ["field", "reason"],
        "properties": {
          "field": {"type": "string", "minLength": 1},
          "reason": {"type": "string", "minLength": 1}
        }
      }
    },
    "invalid_claim_observations": {
      "type": "object",
      "additionalProperties": false,
      "required": [
        "ci_runner_only",
        "claims_intel_from_apple_silicon",
        "claims_os_range_from_single_build",
        "claims_display_topology_from_different_setup",
        "claims_screencapturekit_from_cgdisplaystream",
        "claims_virtual_display_without_result",
        "claims_virtual_display_from_symbol_probe",
        "claims_virtual_display_from_current_main_fallback",
        "claims_dummy_headless_from_attached_monitor"
      ],
      "properties": {
        "ci_runner_only": {"type": "boolean"},
        "claims_intel_from_apple_silicon": {"type": "boolean"},
        "claims_os_range_from_single_build": {"type": "boolean"},
        "claims_display_topology_from_different_setup": {"type": "boolean"},
        "claims_screencapturekit_from_cgdisplaystream": {"type": "boolean"},
        "claims_virtual_display_without_result": {"type": "boolean"},
        "claims_virtual_display_from_symbol_probe": {"type": "boolean"},
        "claims_virtual_display_from_current_main_fallback": {"type": "boolean"},
        "claims_dummy_headless_from_attached_monitor": {"type": "boolean"}
      }
    },
    "closure_checklist": {
      "type": "array",
      "items": {
        "type": "object",
        "additionalProperties": false,
        "required": ["id", "title", "status", "missing_fields", "next_steps"],
        "properties": {
          "id": {"type": "string", "minLength": 1},
          "title": {"type": "string", "minLength": 1},
          "status": {"enum": ["pass", "blocked", "insufficient", "failed"]},
          "missing_fields": {"type": "array", "items": {"type": "string", "minLength": 1}},
          "next_steps": {"type": "array", "items": {"type": "string", "minLength": 1}}
        }
      }
    },
    "missing_requirements": {
      "type": "array",
      "items": {
        "type": "object",
        "additionalProperties": false,
        "required": ["field", "requirement"],
        "properties": {
          "field": {"type": "string", "minLength": 1},
          "requirement": {"type": "string", "minLength": 1}
        }
      }
    },
    "blocking_reasons": {
      "type": "array",
      "items": {
        "type": "object",
        "additionalProperties": false,
        "required": ["field", "requirement"],
        "properties": {
          "field": {"type": "string", "minLength": 1},
          "requirement": {"type": "string", "minLength": 1}
        }
      }
    },
    "artifact_paths": {"type": "array", "items": {"type": "string", "minLength": 1}},
    "artifact_file_check": {
      "type": "object",
      "additionalProperties": false,
      "required": ["enabled", "evidence_dir", "missing_paths", "invalid_paths", "empty_paths"],
      "properties": {
        "enabled": {"type": "boolean"},
        "evidence_dir": {"type": "string"},
        "missing_paths": {"type": "array", "items": {"type": "string", "minLength": 1}},
        "invalid_paths": {"type": "array", "items": {"type": "string", "minLength": 1}},
        "empty_paths": {"type": "array", "items": {"type": "string", "minLength": 1}}
      }
    },
    "artifact_role_check": {
      "type": "object",
      "additionalProperties": false,
      "required": ["required_roles", "observed_roles", "missing_roles", "invalid_paths", "unknown_roles", "duplicate_roles", "multi_role_paths", "roles_by_path"],
      "properties": {
        "required_roles": {"type": "array", "items": {"type": "string", "minLength": 1}},
        "observed_roles": {"type": "array", "items": {"type": "string", "minLength": 1}},
        "missing_roles": {"type": "array", "items": {"type": "string", "minLength": 1}},
        "invalid_paths": {"type": "array", "items": {"type": "string", "minLength": 1}},
        "unknown_roles": {"type": "array", "items": {"type": "string", "minLength": 1}},
        "duplicate_roles": {"type": "array", "items": {"type": "string", "minLength": 1}},
        "multi_role_paths": {"type": "array", "items": {"type": "string", "minLength": 1}},
        "roles_by_path": {
          "type": "object",
          "additionalProperties": {
            "type": "array",
            "minItems": 1,
            "items": {"type": "string", "minLength": 1}
          }
        }
      }
    },
    "blocking_notes": {"type": "array", "items": {"type": "string", "minLength": 1}},
    "notes": {"type": "string"}
  }
}
