{
  "artifact_file_check": {
    "empty_paths": [],
    "enabled": true,
    "evidence_dir": "docs/changes/2026-08-21-host-signing-tcc-preflight/evidence/2026-08-31-macos-host-compatibility-current-base-codex-task-blocked",
    "invalid_paths": [],
    "missing_paths": []
  },
  "artifact_paths": [
    "README.md",
    "macos-hardware-compatibility.json",
    "host-identity.txt",
    "display-topology.txt",
    "host-readiness.json",
    "host-signing-and-permissions.txt"
  ],
  "artifact_role_check": {
    "duplicate_roles": [],
    "invalid_paths": [],
    "missing_roles": [
      "android_device_identity",
      "android_runtime_log",
      "host_runtime_log",
      "visual_stream_evidence"
    ],
    "multi_role_paths": [],
    "observed_roles": [
      "display_topology",
      "gate_input",
      "host_build_identity",
      "host_identity",
      "host_tcc_readiness"
    ],
    "required_roles": [
      "android_device_identity",
      "android_runtime_log",
      "display_topology",
      "gate_input",
      "host_build_identity",
      "host_identity",
      "host_runtime_log",
      "host_tcc_readiness",
      "visual_stream_evidence"
    ],
    "roles_by_path": {
      "display-topology.txt": [
        "display_topology"
      ],
      "host-identity.txt": [
        "host_identity"
      ],
      "host-readiness.json": [
        "host_tcc_readiness"
      ],
      "host-signing-and-permissions.txt": [
        "host_build_identity"
      ],
      "macos-hardware-compatibility.json": [
        "gate_input"
      ]
    },
    "unknown_roles": []
  },
  "blocking_notes": [
    "Host readiness exited 2 with status=blocked; runtime compatibility probes were not started.",
    "The configured Vibe Screen Dev signing identity was not found in the keychain lookup used for rebuild/install readiness.",
    "codesign inspection of the installed Host failed with sealing errors, so the run could not record binary SHA-256, designated requirement, or installed Host source commit/tree provenance.",
    "Screen Recording and Accessibility TCC states are unverified from read-only evidence.",
    "Microphone TCC state is unverified from read-only evidence.",
    "No decoded Screen Recording, Accessibility, or Microphone TCC csreq row matched an inspected Host designated requirement because Host codesign inspection failed.",
    "The Host listener was not observed on TCP port 54321.",
    "The installed Host does not expose the virtual HID entitlement.",
    "Launch-at-login/headless readiness is blocked because Launch at Login is unverified in the default no-sfltool path.",
    "Full Xcode is unavailable because the active developer directory is Command Line Tools; automated macOS build/XCTest/self-test provenance cannot be retained for this current-base row.",
    "This single Apple silicon multi-display machine cannot provide Intel, macOS-range, dummy/headless, Screen Sharing, built-in-only, single-external-only, or other-display-topology compatibility rows."
  ],
  "blocking_reasons": [
    {
      "field": "host_build_identity_recorded",
      "requirement": "record Host app commit, binary SHA-256, bundle id, and signing identity"
    },
    {
      "field": "signing_and_tcc_state_recorded",
      "requirement": "record signing stability plus Screen Recording, Accessibility, and Microphone state"
    },
    {
      "field": "source_bound_host_recorded",
      "requirement": "record installed Host source commit/tree provenance and require it to match this current-base row"
    },
    {
      "field": "host_self_test_provenance_recorded",
      "requirement": "record Host self-test provenance from the same current-base source revision"
    },
    {
      "field": "automated_macos_checks_passed",
      "requirement": "run baseline macOS build, XCTest, and self-test commands for this source"
    },
    {
      "field": "packaged_host_launch_observed",
      "requirement": "launch the packaged Host on the recorded Mac row"
    },
    {
      "field": "protocol_v1_stream_observed",
      "requirement": "observe a Protocol v1 USB or trusted-LAN stream on this Host row"
    },
    {
      "field": "host_build_identity_recorded",
      "requirement": "record the pinned Host signing leaf SHA-1"
    },
    {
      "field": "host_build_identity_recorded",
      "requirement": "record the canonical Host designated requirement used by TCC csreq matching"
    },
    {
      "field": "source_bound_host_recorded",
      "requirement": "record the source commit embedded in the installed Host bundle"
    },
    {
      "field": "source_bound_host_recorded",
      "requirement": "record the source tree embedded in the installed Host bundle"
    },
    {
      "field": "source_bound_host_recorded",
      "requirement": "record whether the installed Host was packaged from a clean source tree"
    },
    {
      "field": "host_self_test_provenance_recorded",
      "requirement": "record the commit used for Host self-test output"
    },
    {
      "field": "signing_and_tcc_state_recorded",
      "requirement": "Screen Recording TCC row csreq must match the packaged Host designated requirement"
    },
    {
      "field": "signing_and_tcc_state_recorded",
      "requirement": "Accessibility TCC row csreq must match the packaged Host designated requirement"
    },
    {
      "field": "signing_and_tcc_state_recorded",
      "requirement": "Microphone TCC row csreq must match the packaged Host designated requirement"
    },
    {
      "field": "signing_and_tcc_state_recorded",
      "requirement": "Screen Recording TCC row must record an accepted user-consent auth_reason"
    },
    {
      "field": "signing_and_tcc_state_recorded",
      "requirement": "Accessibility TCC row must record an accepted user-consent auth_reason"
    },
    {
      "field": "signing_and_tcc_state_recorded",
      "requirement": "Microphone TCC row must record an accepted user-consent auth_reason"
    },
    {
      "field": "signing_and_tcc_state_recorded",
      "requirement": "Screen Recording TCC must be authorized for the packaged Host"
    },
    {
      "field": "signing_and_tcc_state_recorded",
      "requirement": "Accessibility TCC must be authorized for the packaged Host"
    },
    {
      "field": "signing_and_tcc_state_recorded",
      "requirement": "Microphone TCC must be authorized for the packaged Host"
    },
    {
      "field": "artifacts_retained",
      "requirement": "record distinct retained artifact roles for Host identity, Host build/TCC readiness, display topology, Host and Android runtime logs, visual stream evidence, and gate input"
    }
  ],
  "can_close_macos_host_compatibility_row": false,
  "closure_checklist": [
    {
      "id": "source_and_host_identity",
      "missing_fields": [
        "host_build_identity_recorded",
        "host_self_test_provenance_recorded",
        "signing_and_tcc_state_recorded",
        "source_bound_host_recorded",
        "xcode_swift_recorded"
      ],
      "next_steps": [
        "record Xcode and Swift versions used for local build/test evidence",
        "record Host app commit, binary SHA-256, bundle id, and signing identity",
        "record signing stability plus Screen Recording, Accessibility, and Microphone state",
        "record installed Host source commit/tree provenance and require it to match this current-base row",
        "record Host self-test provenance from the same current-base source revision",
        "record the pinned Host signing leaf SHA-1",
        "record the canonical Host designated requirement used by TCC csreq matching",
        "record the source commit embedded in the installed Host bundle",
        "record the source tree embedded in the installed Host bundle",
        "record whether the installed Host was packaged from a clean source tree",
        "record the commit used for Host self-test output",
        "Screen Recording TCC row csreq must match the packaged Host designated requirement",
        "Accessibility TCC row csreq must match the packaged Host designated requirement",
        "Microphone TCC row csreq must match the packaged Host designated requirement",
        "Screen Recording TCC row must record an accepted user-consent auth_reason",
        "Accessibility TCC row must record an accepted user-consent auth_reason",
        "Microphone TCC row must record an accepted user-consent auth_reason",
        "Screen Recording TCC must be authorized for the packaged Host",
        "Accessibility TCC must be authorized for the packaged Host",
        "Microphone TCC must be authorized for the packaged Host"
      ],
      "status": "blocked",
      "title": "Source and Host identity"
    },
    {
      "id": "display_and_encoder_capability",
      "missing_fields": [],
      "next_steps": [],
      "status": "pass",
      "title": "Display and encoder capability"
    },
    {
      "id": "runtime_acceptance",
      "missing_fields": [
        "automated_macos_checks_passed",
        "display_selection_observed",
        "input_smoke_observed",
        "packaged_host_launch_observed",
        "physical_display_capture_observed",
        "protocol_v1_stream_observed",
        "reconnect_observed",
        "runtime_session_coherence_recorded"
      ],
      "next_steps": [
        "run baseline macOS build, XCTest, and self-test commands for this source",
        "launch the packaged Host on the recorded Mac row",
        "observe a Protocol v1 USB or trusted-LAN stream on this Host row",
        "exercise display list and selected-display start on this Host row",
        "observe physical or current-main display capture on this Host row",
        "observe at least touch plus keyboard or scroll input through the Host path",
        "observe a client/process reconnect while the Host PID survives",
        "record that stream, input, and reconnect observations came from the same packaged Host PID/session"
      ],
      "status": "blocked",